Name Event,Description,Date,Audience,Cycle,Veneu,Address,City ,Country,Website,Link
HIGHWAYS SIB 2023,Highways Maintenance and Traffic Management Industry Expo. Highways SIB (Seeing is Believing) brings you the ‘inside-out’ of the highways maintenance and traffic management world with both an indoor exhibition and outside demonstration zones,"June 06 - 08, 2023",Trade Public,every 2 years,National Exhibition Centre,Birmingham B40 1NT,Birmingham (UK - United Kingdom),UK - United Kingdom,http://www.sib.uk.net,https://www.eventseye.com/fairs/f-highways-sib-23486-1.html
FACILITIES MANAGEMENT EXPO 2023,Trade Show showcasing products and services associated with property and building management and maintenance,"June 06 - 08, 2023",Trade Public,once a year,Gallagher Convention Centre,19 Richards Drive Johannesburg,Johannesburg (South Africa),South Africa,http://www.fmexpo.co.za,https://www.eventseye.com/fairs/f-facilities-management-expo-27392-1.html
IRE 2023,"The International Rental Exhibition (IRE) is the hub for the rental industry, with opportunities to meet suppliers and manufacturers face to face, as well as learning about new products and market trends","June 06 - 08, 2023",Trade Public,every 3 years,Maastricht Exhibition & Congress Centre - MECC,Forum 100 6229 GV Maastricht,Maastricht (Netherlands),Netherlands,http://www.ireshow.com,https://www.eventseye.com/fairs/f-ire-25030-1.html
NIGERIA BUILDEXPO 2023,International Building & Contruction Exhibition in Nigeria,"June 06 - 08, 2023",Trade Public,every 2 years,The Landmark Events Centre,Water Corporation Road Victoria Island Annex,Lagos (Nigeria),Nigeria,http://www.nigeriabuildexpo.net,https://www.eventseye.com/fairs/f-nigeria-buildexpo-23199-1.html
PARKEX INTERNATIONAL 2023,"Europe's Largest dedicated Parking Event. By exhibiting at the combined Traffex Parkex you get to meet first hand over 10, 000 of the UK and Europe's most influential buyers in the traffic, transport, parking and highway maintenance industries","June 06 - 08, 2023",Trade Public,once a year,National Exhibition Centre,Birmingham B40 1NT,Birmingham (UK - United Kingdom),UK - United Kingdom,http://www.parkex.net,https://www.eventseye.com/fairs/f-parkex-international-8223-1.html
PRODMASH. HOLOD. UPACK. 2023,"Equipment for food processing industry, equipment for public catering establishments. Ingredients, spices, food additives. Packaging machinery, materials and accessories, manufacturing machinery, packaging industry services. Refrigerating equipment...","June 06 - 10, 2023",Trade Public,once a year,Minsk-Arena,pr-t Pobediteleiy 111 Minsk,Minsk (Belarus),Belarus,http://www.minskexpo.com/english/prodmash-holod-upak,https://www.eventseye.com/fairs/f-prodmash.-holod.-upack-15357-1.html
SECUREX SOUTH AFRICA 2023,"Largest International Trade Show in South Africa dedicated to Commercial, Homeland and Cyber Security, Fire Protection and Safety","June 06 - 08, 2023",Trade Public,once a year,Gallagher Convention Centre,19 Richards Drive Johannesburg,Johannesburg (South Africa),South Africa,http://www.securex.co.za,https://www.eventseye.com/fairs/f-securex-south-africa-5729-1.html
TRAFFEX 2023,"International Traffic Engineering and Road Safety Exhibition. By visiting Traffex you will find hundreds of new ideas that will save you time, energy & money. New product launches, expert advice & services. Prices from over 500 market-leading companies","June 06 - 08, 2023",Trade Public,every 2 years,National Exhibition Centre,Birmingham B40 1NT,Birmingham (UK - United Kingdom),UK - United Kingdom,http://www.traffex.com,https://www.eventseye.com/fairs/f-traffex-2731-1.html
STEEL STRUCTURES 2023,"SteelStructures will bring together building steel products manufacturers, suppliers and end-users. Steel structures manufacturers and steel service centers will exhibit their latest solutions for the construction industry","June 06 - 08, 2023",Trade Public,once a year,Expocentr' Krasnaya Presnya Fairgrounds,"14, Krasnopresnenskaya naberezhnaya Moscow 123100",Moscow (Russia),Russia,http://mc-expo.ru/en,https://www.eventseye.com/fairs/f-steel-structures-23175-1.html
ZAK WORLD OF FAÇADES - EGYPT 2023,Zak World of Façades is an International conference series on façade design & engineering,"on June 06, 2023",Trade Public,once a year,Cairo International Convention & Exhibition Centre,El-Nasr Rd Al Estad,Cairo (Egypt),Egypt,http://zakworldoffacades.com,https://www.eventseye.com/fairs/f-zak-world-of-facades-egypt-27610-1.html
SUISSE PUBLIC 2023,"The largest trade fair in Switzerland in the field of public procurement. It attracts decision-makers from companies and public administrations, who come to inquire about trends for municipalities and cities of tomorrow","June 06 - 09, 2023",Trade Public,every 3 years,BEA Bern Expo,Mingerstrasse 6 Bern 22,Bern (Switzerland),Switzerland,http://www.suissepublic.ch,https://www.eventseye.com/fairs/f-suisse-public-22278-1.html
AIA CONVENTION 2023,"The American Institute of Architects Expo & Convention. AIA National Convention & Design Exposition brings together principals, partners, & other top level leaders who set budgets, select vendors, & specify products, materials, technologies, and services","June 07 - 10, 2023",Trade Public,once a year,Moscone Convention Center,"747 Howard Street San Francisco, CA 94103","San Francisco, CA (USA)",USA,http://conferenceonarchitecture.com,https://www.eventseye.com/fairs/f-aia-convention-14307-1.html
TANZANIA BUILD 2023,"International Building, Construction, Energy, Electricity and Municipal Equipment Exhibition","June 06 - 08, 2023",Trade Public,once a year,Diamond Jubilee Hall,Barabara ya Malik Dar es Salaam,Dar Es Salaam (Tanzania),Tanzania,http://pyramidsfair.com/fairs,https://www.eventseye.com/fairs/f-tanzania-build-29329-1.html
THE NATURAL STONE SHOW 2023,"International Natural Stone Fair. Stone slabs, tiling or block, CNC machinery; diamond tooling, fixing systems, sealants, adhesives, cleaning, materials & service","June 06 - 08, 2023",Trade Public,every 2 years,ExCeL,One Western Gateway Royal Victoria Dock,London (UK - United Kingdom),UK - United Kingdom,http://www.stoneshow.co.uk,https://www.eventseye.com/fairs/f-the-natural-stone-show-29203-1.html
BUILDEX 2023,"International Construction Fair. BUILDEX provides the best platform for companies to capitalize on the active and promising Syrian market, specifically by facilitating productive interaction between suppliers, manufacturers, buyers, decision makers...","June 07 - 11, 2023",Trade Public,once a year,Damascus International Fairground,International Airport Higway Damascus,Damascus (Syria),Syria,http://www.buildexexpo.com,https://www.eventseye.com/fairs/f-buildex-28523-1.html
ECO LIVING IBERIA 2023,"Eco Life Iberia is the largest sustainable B2B trade event in the Nordic countries for trade buyers in the healthy living, nutrition, natural beauty and self-care sectors","June 07 - 08, 2023",Trade Public,once a year,Ifema - Parque Ferial Juan Carlos I,Feria de Madrid 28042 Madrid,Madrid (Spain),Spain,http://www.organicfoodiberia.com/en/eco-living-iberia,https://www.eventseye.com/fairs/f-eco-living-iberia-29115-1.html
HI DESIGN EUROPE 2023,Hotel Interior Design - The Decision Makers' Forum,"June 07 - 09, 2023",Trade Public,once a year,Mövenpick Hotel Mansour Eddahbi,Avenue Mohammed Vi Hivernage 40000 Marrakech,Marrakech (Morocco),Morocco,http://www.hidesigneurope.com,https://www.eventseye.com/fairs/f-hi-design-europe-24928-1.html
"HVAC, W SYRIA 2023","Heating, Ventilation, Air Conditioning and Water Exhibition. HVAC, W factors in supporting the building sector in Syria and the region by representing a platform for the exchange of expertise between exhibitors and visitors","June 07 - 11, 2023",Trade Public,once a year,Damascus International Fairground,International Airport Higway Damascus,Damascus (Syria),Syria,http://www.hvac.sy/en,https://www.eventseye.com/fairs/f-hvac-w-syria-28524-1.html
LEBENSART MESSE - NEURUPPIN 2023,"Garden, Home and Lifestyle Fair. In addition to seasonal products from the world of gardens and plants, new ideas from the living and furnishing sector as well as selected exhibits from fashion, jewelry and accessories ensure a harmonious ambience","June 09 - 11, 2023",Trade & General Public,once a year,Gut Hesterberg,"1, Gutsallee 16818 Neuruppin",Neuruppin (Germany),Germany,http://www.lebensart-messe.de/LebensArt-Messe-Neuruppin.html,https://www.eventseye.com/fairs/f-lebensart-messe-neuruppin-24186-1.html
KBC - KITCHEN & BATH CHINA 2023,China Kitchen & Bath Exhibition,"June 07 - 10, 2023",Trade Public,once a year,Shanghai New International Expo Centre,"2345 Longyang Road, Pudong New Area Shanghai P.R.C. 201204",Shanghai (China),China,http://www.wes-expo.com.cn,https://www.eventseye.com/fairs/f-kbc-kitchen-bath-china-8110-1.html
LIFE STYLE 2023,"Furniture, Decor and Home/Office Appliances Exhibition in Syria","June 07 - 11, 2023",Trade Public,once a year,Damascus International Fairground,International Airport Higway Damascus,Damascus (Syria),Syria,http://www.buildexexpo.com,https://www.eventseye.com/fairs/f-life-style-28525-1.html
SOUTH BAY HOME & BACKYARD SHOW 2023,"Home improvements and remodeling show in Long Beach, C. THE SOUTH BAY HOME & BACKYARD SHOW features furniture, kitchen appliances, bathroom designs, construction & renovation services, re-modeling ideas, interior designers...","June 09 - 11, 2023",Trade & General Public,unknown,Long Beach Convention Center,"300 East Ocean Boulevard Long Beach, California 90802","Long Beach, CA (USA)",USA,http://www.homeshowconsultants.com,https://www.eventseye.com/fairs/f-south-bay-home-backyard-show-29531-1.html
ACE 2023,AWWA (American Water Works Association) Annual Conference & Expo. ACE program presents solutions to water sector challenges in grouped sessions. Listen & join the discussion as experts share real-world experiences on today’s hot topics,"June 11 - 14, 2023",Trade Public,once a year,?,,"Toronto, ON (Canada)",USA,http://www.awwa.org/ace/General-Information/Future-ACE-Dates,https://www.eventseye.com/fairs/f-ace-10677-1.html
GUANGZHOU ELECTRICAL BUILDING TECHNOLOGY 2023,Exhibition of electrical and lighting technologies for the building Industry,"June 09 - 12, 2023",Trade Public,once a year,China Import and Export Fair Pazhou Complex,"No. 382, Yuejiang Zhong Road Guangzhou 510335",Guangzhou (China),China,http://www.building.messefrankfurt.com.cn,https://www.eventseye.com/fairs/f-guangzhou-electrical-building-technology-18893-1.html
DESIGN SHANGHAI 2023,"International Design Expo. Design Shanghai provides a unique and exciting showcase of latest furniture designs for China’s top architects, interior designers, developers, facilities managers and private buyers","June 08 - 11, 2023",Trade Public,once a year,Shanghai World Expo Exhibition & Convention Center,1099 Guozhan Rd. Shanghai 200126,Shanghai (China),China,http://www.designshanghai.com,https://www.eventseye.com/fairs/f-design-shanghai-20989-1.html
WINTER GIFT & HOMEWARE FAIR 2023,Gift & Homeware Fair,"June 11 - 12, 2023",Trade Public,once a year,Air Force Museum of New Zealand,"45 Harvard Avenue, Wigram Christchurch 8042",Auckland (New Zealand),New Zealand,http://www.giftfairs.co.nz,https://www.eventseye.com/fairs/f-winter-gift-homeware-fair-12912-1.html
GUANGZHOU INTERNATIONAL LIGHTING EXHIBITION 2023,International Lighting Exhibition,"June 09 - 12, 2023",Trade Public,once a year,China Import and Export Fair Pazhou Complex,"No. 382, Yuejiang Zhong Road Guangzhou 510335",Guangzhou (China),China,http://www.light.messefrankfurt.com.cn,https://www.eventseye.com/fairs/f-guangzhou-international-lighting-exhibition-13267-1.html
EXPERIENCE LUXEHOME AT NEOCON 2023,Large collection of premier boutiques for home building and renovation,"June 12 - 14, 2023",Trade & General Public,once a year,The Mart,"222 Merchandise Mart Plaza  Chicago, IL 60654","Chicago, IL (USA)",USA,http://luxehome.com/events,https://www.eventseye.com/fairs/f-experience-luxehome-at-neocon-15560-1.html
FINE DESIGN RESIDENTIAL FURNISHINGS SHOW AT NEOCON 2023,"Specialized Decorating Materials & Interior Design Exhibition. NeoCon will enable you to discover thousands of innovative products & resources for corporate hospitality, healthcare, retail, government, institutional & residential interiors","June 12 - 14, 2023",Trade Public,once a year,The Mart,"222 Merchandise Mart Plaza  Chicago, IL 60654","Chicago, IL (USA)",USA,http://www.neocon.com,https://www.eventseye.com/fairs/f-fine-design-residential-furnishings-show-at-neocon-15568-1.html
NEOCON 2023,North America’s most important design exposition and conference for commercial interiors,"June 12 - 14, 2023",Trade Public,once a year,The Mart,"222 Merchandise Mart Plaza  Chicago, IL 60654","Chicago, IL (USA)",USA,http://www.neocon.com,https://www.eventseye.com/fairs/f-neocon-23596-1.html
TOC CONTAINER SUPPLY CHAIN EUROPE 2023,"Exhibition and Conference for Shipping, Ports and Terminal Industries","June 13 - 15, 2023",Trade Public,once a year,Ahoy Rotterdam,Ahoy'-weg 10 3084 BA Rotterdam,Rotterdam (Netherlands),Netherlands,http://www.tocevents-europe.com,https://www.eventseye.com/fairs/f-toc-container-supply-chain-europe-16291-1.html
ASIA INFRASTRUCTURE 2023,Asia’s International Infrastructure Development Exhibition & Conference,"June 13 - 15, 2023",Trade Public,every 2 years,"Borneo Convention Centre, Kuching","Queen's Court, Sublot-5 Lot 9936, 4th Floor, Block E,",Kuching (Malaysia),Malaysia,http://www.ambtarsus.com/calendar-malaysia.htm,https://www.eventseye.com/fairs/f-asia-infrastructure-25507-1.html
DRC MINING WEEK 2023,Mining Industry Exhibition & Conference in Democratic Republic of the Congo,"June 14 - 16, 2023",Trade Public,once a year,Pullman Lubumbashi Grand Karavia Hotel,"55, Route du Golf Lubumbashi",Lubumbashi (Congo-Kinshasa),Congo-Kinshasa,http://www.drcminingweek.com,https://www.eventseye.com/fairs/f-drc-mining-week-26729-1.html
CHINA HOMELIFE DUBAI 2023,China Homelife Dubai has grown into the biggest sourcing platform of Chinese products in Middle East and North Africa area,"June 13 - 15, 2023",Trade Public,once a year,Dubai World Trade Centre (Dubai Exhibition Centre),Sheik Zayed Road Convention Gate,Dubai (UAE - United Arab Emirates),UAE - United Arab Emirates,http://www.chinahomelife.ae,https://www.eventseye.com/fairs/f-china-homelife-dubai-20906-1.html
FURNITURE & INTERIOR KAZAKHSTAN 2023,"International Exhibition dedicated to Home and Office Furniture, Interior Design, Accessories, Equipment and Technologies, Lighting Systems & Finishing Materials","June 14 - 16, 2023",Trade Public,once a year,Atakent International Exhibition Centre,"42, Timiryazev Str. Almaty, 050057",Almaty (Kazakhstan),Kazakhstan,http://www.atakentexpo.kz,https://www.eventseye.com/fairs/f-furniture-interior-kazakhstan-22019-1.html
IAAPA EXPO ASIA 2023,"Amusement Parks and Attractions Industry's Premier Conference and Tradeshow. More than 3, 000 professionals from 40 countries will be looking for products and business partners","June 13 - 16, 2023",Trade Public,once a year,Marina Bay Sands,10 Bayfront Avenue Singapore 018956,Singapore (Singapore),Singapore,http://www.iaapa.org/expos/asian-attractions-expo,https://www.eventseye.com/fairs/f-iaapa-expo-asia-9237-1.html
M&CEE EXPO - MARINE & COASTAL CIVIL ENGINEERING 2023,"The Event to find Solutions, Equipment and Infrastructure for Coastal and Marine Projects","June 13 - 15, 2023",Trade Public,once a year,Mayflower Park / Town Quay,Southampton SO15 1AG,Southampton (UK - United Kingdom),UK - United Kingdom,http://www.mcceexpo.co.uk,https://www.eventseye.com/fairs/f-m-cee-expo-marine-coastal-civil-engineering-26280-1.html
IFFT/INTERIORLIFESTYLE LIVING 2023,"IFFT/Interior Lifestyle Living is an international trade fair that showcases lifestyle concepts in the interior design market, from Tokyo and around the world","June 14 - 16, 2023",Trade & General Public,once a year,Tokyo International Exhibition Center (Tokyo Big Sight),3-21-1 Ariake Koto-ku,Tokyo (Japan),Japan,http://interior-lifestyle.jp.messefrankfurt.com/japan/en.html,https://www.eventseye.com/fairs/f-ifft-interiorlifestyle-living-13884-1.html
SEAWORK 2023,"International Commercial Marine Exhibition & Conference. For 3 days, Seawork encourages the industry to meet, greet, compare, contrast & make purchasing decisions. The conference is a leading forum reflecting the range of commercial marine activities","June 13 - 15, 2023",Trade Public,once a year,Mayflower Park / Town Quay,Southampton SO15 1AG,Southampton (UK - United Kingdom),UK - United Kingdom,http://www.seawork.com,https://www.eventseye.com/fairs/f-seawork-6110-1.html
INTERIOR LIFESTYLE TOKYO 2023,International Interior Exhibition in Japan,"June 14 - 16, 2023",Trade & General Public,once a year,Tokyo International Exhibition Center (Tokyo Big Sight),3-21-1 Ariake Koto-ku,Tokyo (Japan),Japan,http://www.interior-lifestyle.com,https://www.eventseye.com/fairs/f-interior-lifestyle-tokyo-9086-1.html
INTERTRAFFIC ISTANBUL 2023,"International Trade Show for the infrastructure, ITS traffic management, safety and parking sectors","June 14 - 16, 2023",Trade Public,every 2 years,Istanbul Expo Center / Istanbul Fuar Merkezi / CNR Expo,"Atatürk Havalimani Karsisi 34149 Yesilköy, Istanbul",Istanbul (Turkey),Turkey,http://www.intertraffic.com/en/istanbul,https://www.eventseye.com/fairs/f-intertraffic-istanbul-4795-1.html
ISSA SHOW CANADA 2023,"International Trade Fair for Industrial Cleaning, Maintenance and Building Services","June 14 - 15, 2023",Trade Public,once a year,Metro Toronto Convention Centre,"255 Front Street West  Toronto, ON","Toronto, ON (Canada)",Canada,http://canadashow.issa.com,https://www.eventseye.com/fairs/f-issa-show-canada-27207-1.html
DESIGN SHOW AUSTRALIA 2023,"Australia's premier exhibition bringing together premium brands, manufacturers and suppliers with designers, specifiers and buyers working in commercial, work, retail, hospitality and residential interiors","June 15 - 17, 2023",Trade Public,once a year,Melbourne Exhibition & Convention Centre,2 Clarendon Street Southbank,Melbourne (Australia),Australia,http://designshow.com.au,https://www.eventseye.com/fairs/f-design-show-australia-29299-1.html
ITS CANADA ANNUAL CONFERENCE 2023,Congress on intelligent transport systems and service,"June 14 - 16, 2023",Trade Public,once a year,St. Clair College Centre for the Arts,St. Clair College Centre for the Arts 201 Riverside Dr W,"Windsor, ON (Canada)",Canada,http://www.itscanada.ca,https://www.eventseye.com/fairs/f-its-canada-annual-conference-16987-1.html
KIELCE IFRE-EXPO 2023,International Fire Protection & Rescue Exhibition,"June 15 - 17, 2023",Trade Public,every 2 years,Kielce Fairground,Zakladowa 1 25-672 Kielce,Kielce (Poland),Poland,http://www.targikielce.pl/en,https://www.eventseye.com/fairs/f-kielce-ifre-expo-25217-1.html
PLASTICS EXTRUSION WORLD EXPO EUROPE 2023,"International exhibition for the film, sheet, pipe and profile extrusion industry","June 14 - 15, 2023",Trade Public,every 2 years,Messe Essen,Norbertstrasse D - 45131 Essen,Essen (Germany),Germany,http://eu.extrusion-expo.com,https://www.eventseye.com/fairs/f-plastics-extrusion-world-expo-europe-28375-1.html
KIELCE WORK SAFETY-EXPO 2023,Occupational Safety and Fire Security Protection Systems Trade Show,"June 15 - 17, 2023",Trade Public,every 2 years,Kielce Fairground,Zakladowa 1 25-672 Kielce,Kielce (Poland),Poland,http://www.targikielce.pl/en/kielce-work-safety-expo,https://www.eventseye.com/fairs/f-kielce-work-safety-expo-25218-1.html
"SALON DES MAIRES, DES COLLECTIVITÉS TERRITORIALES ET DE L'ACTION PUBLIQUE 2023","Trade show for mayors, local authorities and public action","June 14 - 15, 2023",Trade Public,every 2 years,Espace Carat,"54, avenue Jean Mermoz 16340 L'isle d'Espagnac",Angoulême (France),France,http://www.salon-achat-public.fr,https://www.eventseye.com/fairs/f-salon-des-maires-des-collectivites-territoriales-et-de-l-action-publique-26492-1.html
SOLSCOPE 2023,"International meeting of professionals in Geotechnics, Drilling and Foundations. A rich place for exchanges between project owners, construction companies, design offices, suppliers of materials and services, experts and insurers","June 14 - 15, 2023",Trade Public,every 2 years,Eurexpo,Bd de l'Europe 69680 Chassieu,Lyon (France),France,http://www.solscope.fr/en,https://www.eventseye.com/fairs/f-solscope-28260-1.html
BEAUTY EURASIA 2023,"International Exhibition for Beauty Products, Cosmetics, Perfumery, Beauty/Hair Salons, Packaging, Private Label, Wellness and Spa","June 15 - 17, 2023",Trade Public,once a year,Istanbul Expo Center / Istanbul Fuar Merkezi / CNR Expo,"Atatürk Havalimani Karsisi 34149 Yesilköy, Istanbul",Istanbul (Turkey),Turkey,http://beautyeurasia.com/home?lang=en-GB,https://www.eventseye.com/fairs/f-beauty-eurasia-7849-1.html
SKOGS NOLIA 2023,"Northern Sweden's most important Forest Fair. This is where the industry meets: forest owners, forest entrepreneurs, drivers, forest researchers, companies, authorities, forest owner associations, forest companies...","June 15 - 17, 2023",Trade Public,once a year,Noliahallarna,Signalvägen 3 Umeå,Umeå (Sweden),Sweden,http://www.skogsnolia.se,https://www.eventseye.com/fairs/f-skogs-nolia-29424-1.html
GAME FAIR 2023,"Open Air Leisure, Hunting & Fishing Fair","June 16 - 18, 2023",Trade & General Public,once a year,Parc Équestre Fédéral,Lamotte-Beuvron,Lamotte-Beuvron (France),France,http://www.gamefair.fr,https://www.eventseye.com/fairs/f-game-fair-9369-1.html
LEBENSART MESSE - GROßHARTHAU 2023,"Garden, Home and Lifestyle Fair. In addition to seasonal products from the world of gardens and plants, new ideas from the living and furnishing sector as well as selected exhibits from fashion, jewelry and accessories ensure a harmonious ambience","June 16 - 18, 2023",Trade & General Public,once a year,Schlosspark,Großharthau,Großharthau (Germany),Germany,http://www.lebensart-messe.de/LebensArt-Messe-Grossharthau.html,https://www.eventseye.com/fairs/f-lebensart-messe-grosharthau-24182-1.html
PERTH HIA HOME SHOW 2023,"Home Decor, Design & renovation Expo. Perth HIA Home Show is the perfect exhibition for your new build or renovation, from kitchens, bathroom products, interiors, outdoor, energy saving products and more","June 16 - 18, 2023",Trade & General Public,once a year,Perth Convention Exhibition Centre,"21 Mounts Bay Rd Perth WA 6000,",Perth (Australia),Australia,http://www.perthhomeshow.com.au,https://www.eventseye.com/fairs/f-perth-hia-home-show-24593-1.html
SHANGHAI INTERNATIONAL LIGHTING FAIR 2023,"Exhibition on Lighting Products, Systems, Technologies and Allied Products","June 18 - 21, 2023",Trade & General Public,once a year,National Exhibition and Convention Center,No.335 Huaxu Rd. Qingpu District,Shanghai (China),China,http://www.apppexpo.com/index/3/en,https://www.eventseye.com/fairs/f-shanghai-international-lighting-fair-19177-1.html
EGYPT INTERNATIONAL SECURITY & SAFETY EXHIBITION AND CONFERENCE 2023,Egypt International security and Safety Exhibition & Conference,"June 19 - 21, 2023",Trade Public,once a year,EIEC (Egypt International Exhibition Center),"El-Moshir Tantawy Axis New Cairo, Cairo",Cairo (Egypt),Egypt,http://www.eise.com,https://www.eventseye.com/fairs/f-egypt-international-security-safety-exhibition-and-conference-29222-1.html
SPOGA+GAFA 2023,"International Trade Fair for Sport, Camping and Garden Lifestyle","June 18 - 20, 2023",Trade & General Public,once a year,Exhibition Centre Cologne,Messeplatz 1 50679 Köln,Cologne (Germany),Germany,http://www.spogagafa.com,https://www.eventseye.com/fairs/f-spoga-gafa-1109-1.html
SILE - LED SHANGHAI 2023,Shanghai International Lighting Expo - China International LED Industrial Technology Expo & Forum,"June 18 - 21, 2023",Trade Public,once a year,National Exhibition and Convention Center,No.335 Huaxu Rd. Qingpu District,Shanghai (China),China,http://www.apppexpo.com/index/3/en,https://www.eventseye.com/fairs/f-sile-led-shanghai-18234-1.html
SAITEX 2023,"SAITEX is the largest product sourcing trade show in Africa featuring electronics and home appliances, homeware and household products as well as building materials and tools","June 18 - 20, 2023",Trade & General Public,once a year,Gallagher Convention Centre,19 Richards Drive Johannesburg,Johannesburg (South Africa),South Africa,http://www.saitexafrica.com,https://www.eventseye.com/fairs/f-saitex-20148-1.html
EGYPT INFRASTRUCTURE & WATER EXPO 2023,"Egypt Infrastructure & Water Expo will showcase the planning, engineering, systems, communication networks and utilities needed to realise Egypt’s ambitious plan for the country’s infrastructure catering to Egypt’s rapid population growth","June 19 - 21, 2023",Trade Public,once a year,EIEC (Egypt International Exhibition Center),"El-Moshir Tantawy Axis New Cairo, Cairo",Cairo (Egypt),Egypt,http://www.egyptinfrastructureexpo.com,https://www.eventseye.com/fairs/f-egypt-infrastructure-water-expo-29221-1.html
SACROEXPO 2023,"International Exhibition of Church Construction, Church Fittings and Furnishings and Religious Art","June 19 - 21, 2023",Trade & General Public,once a year,Kielce Fairground,Zakladowa 1 25-672 Kielce,Kielce (Poland),Poland,http://www.targikielce.pl/pl/sacroexpo.htm,https://www.eventseye.com/fairs/f-sacroexpo-8844-1.html
CERAMICS CHINA 2023,"International Exhibition for Ceramics Technology, Equipment and Product in China","June 19 - 22, 2023",Trade Public,every 2 years,China Import and Export Fair Pazhou Complex,"No. 382, Yuejiang Zhong Road Guangzhou 510335",Guangzhou (China),China,http://www.ceramicschina.com.cn,https://www.eventseye.com/fairs/f-ceramics-china-5185-1.html
