Name Event,Description,Date,Audience,Cycle,Veneu,Address,City ,Country,Website,Link
FORMNEXT SOUTH CHINA 2023,Shenzhen International Additive Manufacturing Powder Metallurgy and Advanced Ceramics Exhibition,on Sept. 2023 (?),Trade Public,once a year,Shenzhen World Exhibition & Convention Center,No.1 Zhancheng Road Fuhai Street,Shenzhen (China),China,http://en.unifair.com,https://www.eventseye.com/fairs/f-formnext-south-china-27929-1.html
HAICO 2023,"International Heating, Cooling and Air Conditioning Systems Trade Fair of Iran",on Sept. 2023 (?),Trade Public,once a year,Permanent Ground For Tabriz International Exhibition Co.,Km 3 Tabriz - Tehran road Tabriz,Tabriz (Iran),Iran,http://www.tabrizfair.ir/FairCalendar.aspx?Type=1,https://www.eventseye.com/fairs/f-haico-17246-1.html
HOTEL & SPA TECH LIVE 2023,Hotel & Spa Innovation and Technology Expo,on Sept. 2023 (?),Trade Public,once a year,ExCeL,One Western Gateway Royal Victoria Dock,London (UK - United Kingdom),UK - United Kingdom,http://www.hoteltechlive.co.uk,https://www.eventseye.com/fairs/f-hotel-spa-tech-live-26286-1.html
HAUTE FOIRE HABITAT ET GASTRONOMIE DE PONTARLIER 2023,"A must-see event at the Haut Doubs, the Haute Foire showcases professionals from many sectors of activity: artisans, tradesmen, producers, and a multitude of professionals at your service during these 5 days of festivities",on Sept. 2023 (?),General Public,every 2 years,Espace René Pourny,Place René Pourny 25300 Pontarlier,Pontarlier (France),France,http://www.haute-foire.com,https://www.eventseye.com/fairs/f-haute-foire-habitat-et-gastronomie-de-pontarlier-14085-1.html
HOLY RUSSIA - IRKUTSK 2023,"Church Architecture, Construction & Restoration, Book-Printing, Church Utensils, Religion Education",on Sept. 2023 (?),Trade & General Public,once a year,Sibexpocentre,"253A, Baikalskaya St. Irkutsk",Irkutsk (Russia),Russia,http://pravoslav-expo.ru/holyrussia-irk,https://www.eventseye.com/fairs/f-holy-russia-irkutsk-18340-1.html
HVAC/R PHILIPPINES - DAVAO 2023,"International Heating, Ventilating, Air-Conditioning and Refrigerating Technology Exhibition & Conference",on Sept. 2023 (?),Trade Public,once a year,"SMX Convention Center, Davao",SM Lanang Premier J.P. Laurel Ave,Davao City (Philippines),Philippines,http://www.globallinkmp.com,https://www.eventseye.com/fairs/f-hvac-r-philippines-davao-24781-1.html
IMMEXPO TOULON 2023,Real Estate and Renovation Fair,on Sept. 2023 (?),Trade & General Public,once a year,Palais des Congrès Neptune,Place de Besagne Centre Mayol,Toulon (France),France,http://www.immexpo-toulon.com,https://www.eventseye.com/fairs/f-immexpo-toulon-26895-1.html
HOSPITALITY DESIGN FAIR 2023,Hospitality Design Fair is the premier trade fair and conference for creative professionals who shape the hospitality interiors marketplace and create amazing spaces,on Sept. 2023 (?),Trade Public,once a year,ICC Sydney - International Convention Centre Sydney,14 Darling Dr Sydney NSW 2009,Sydney (Australia),Australia,http://nationalmedia.com.au/#!/hospitality-design-fair,https://www.eventseye.com/fairs/f-hospitality-design-fair-26896-1.html
INTERIOR LIFESTYLE CHINA 2023,China International Trade Fair for Household Products and Accessories,on Sept. 2023 (?),Trade & General Public,once a year,Shanghai New International Expo Centre,"2345 Longyang Road, Pudong New Area Shanghai P.R.C. 201204",Shanghai (China),China,http://interior-lifestyle-china.hk.messefrankfurt.com/shanghai/en/visitors/welcome.html,https://www.eventseye.com/fairs/f-interior-lifestyle-china-10929-1.html
INTERLIGHT RUSSIA | INTELLIGENT BUILDING RUSSIA 2023,"International Trade Fair for Decorative and Technical Lighting, Electrical Engineering, Home and Building Automation",on Sept. 2023 (?),Trade Public,once a year,Crocus-Expo IEC,Krasnogorsk 65-66 km Moscow Ring Road,Moscow (Russia),Russia,http://interlight-building.ru.messefrankfurt.com/moscow/en.html,https://www.eventseye.com/fairs/f-interlight-russia-intelligent-building-russia-2979-1.html
KITCHEN & BATHROOM INDONESIA 2023,Kitchen + Bathroom Indonesia fulfils every home lovers’ desire for beautiful state-of-the-art kitchen and bathroom facilities that are equipped with high-technology applications and solutions,on Sept. 2023 (?),Trade & General Public,once a year,Jakarta International Expo (JIExpo),Gedung Pusat Niaga Lt. 1 Arena PRJ Kemayoran,Jakarta (Indonesia),Indonesia,http://www.kitchenbathroomindonesia.com,https://www.eventseye.com/fairs/f-kitchen-bathroom-indonesia-23727-1.html
NY LUXURY DESIGN FAIR 2023,"International Design Show. An innovative and immersive design experience for designers, architects and consumers",on Sept. 2023 (?),Trade Public,once a year,New York Piers 92 / 94,755 12th Ave. at 55th St. New York  NY  10019,"New York, NY (USA)",USA,http://nyluxurydesignfair.com,https://www.eventseye.com/fairs/f-ny-luxury-design-fair-23436-1.html
MÉDINIT EXPO - BEIJING 2023,Exhibition of Italian design and technology for the interior design and construction. Médinit EXPO is a showcase where leading Made in Italy companies can present their products and technologies to the Moroccan market,on Sept. 2023 (?),Trade & General Public,once a year,National Agricultural Exhibition Center (NAEC),16 Dongsanhuan Bei Road Chaoyang District,Beijing (China),China,http://www.medinit.it/medinit_casablanca.html,https://www.eventseye.com/fairs/f-medinit-expo-beijing-28757-1.html
LIVING & LIFESTYLE - BUSAN 2023,International Korean Exhibition dedicated to Interior Design & Lifestyle Products,on Sept. 2023 (?),Trade & General Public,once a year,Bexco (Busan Exhibition & Convention Center),55 Apec-ro Haeundae-gu,Busan (Korea South),Korea South,http://livinglifestyle.co.kr/busan,https://www.eventseye.com/fairs/f-living-lifestyle-busan-28100-1.html
PISCIMAD 2023,"Pool and Garden Fair. Prefabricated pools and surface spas, technology systems, home automation and automation for water disinfection, systems for saving electricity and water consumption...",on Sept. 2023 (?),Trade & General Public,once a year,Ifema - Parque Ferial Juan Carlos I,Feria de Madrid 28042 Madrid,Madrid (Spain),Spain,http://www.ifema.es/piscimad,https://www.eventseye.com/fairs/f-piscimad-29031-1.html
MIDDLE EAST CLEANING TECHNOLOGY WEEK 2023,Middle East Cleaning Technology Week is the region’s leading trade show that brings the entire cleaning and hygiene industries together,on Sept. 2023 (?),Trade Public,once a year,Dubai World Trade Centre (Dubai Exhibition Centre),Sheik Zayed Road Convention Gate,Dubai (UAE - United Arab Emirates),UAE - United Arab Emirates,http://mectw.com,https://www.eventseye.com/fairs/f-middle-east-cleaning-technology-week-20340-1.html
POOL EXPO 2023,"Swimming pools, SPA, Sauna and Equipments Exhibition",on Sept. 2023 (?),Trade Public,every 2 years,Tüyap Fair Convention and Congress Center,E-5 Karayolu Gürpinar Kavsagi,Istanbul (Turkey),Turkey,http://www.poolexpo.org/en,https://www.eventseye.com/fairs/f-pool-expo-14754-1.html
PROFESSIONAL BEAUTY MUMBAI 2023,"B2B trade show for beauty, spa and wellness professionals",on Sept. 2023 (?),Trade Public,once a year,Bombay Convention & Exhibition Centre (BCEC),"Highway, Goreagon (East) Mumbai - 400 063",Mumbai (India),India,http://www.professionalbeauty.in,https://www.eventseye.com/fairs/f-professional-beauty-mumbai-16993-1.html
PROMAISONSHOW 2023,International Exhibition of Tableware and Household,on Sept. 2023 (?),Trade Public,once a year,Kiev International Exhibition Center,"15, Brovarsky Ave Kyiv",Kiev (Ukraine),Ukraine,http://pem.com.ua/en,https://www.eventseye.com/fairs/f-promaisonshow-28497-1.html
PROTECTION TECHNOLOGIES 2023,International Trade Fair for Emergency Safety Facilities & Fire Protection Systems and Technologies,on Sept. 2023 (?),Trade Public,once a year,Kiev International Exhibition Center,"15, Brovarsky Ave Kyiv",Kiev (Ukraine),Ukraine,http://www.iec-expo.com.ua/en,https://www.eventseye.com/fairs/f-protection-technologies-6904-1.html
RAH EXPO PAKISTAN 2023,"RAH EXPO is the display and interaction of latest refrigeration, cooling, humidification and ventilation products on single value based Platform. The exhibitors include manufacturers of all types of HVACR & Allied Products",on Sept. 2023 (?),Trade Public,once a year,Expo Centre Lahore,158-H Johar Town Lahore,Lahore (Pakistan),Pakistan,http://rahexpo.com,https://www.eventseye.com/fairs/f-rah-expo-pakistan-26617-1.html
SALON HABITAT & DÉCORATION 2023,Salon de l'habitat et de la décoration. De l’équipement de son intérieur et extérieur jusqu’à la construction de son habitation,on Sept. 2023 (?),Trade & General Public,once a year,Parc des Expositions de Troyes - Le Cube,"20, Rue Gayettes 10000 Troyes",Troyes (France),France,http://www.maisonduboulanger.com/l-agenda/spectacle_SALON-HABITAT-DECORATION_976.html,https://www.eventseye.com/fairs/f-salon-habitat-decoration-19741-1.html
RAW MAT INDIA 2023,Indian's Great Resource & Industry Expo,on Sept. 2023 (?),Trade Public,once a year,Codissia Trade Fair Complex,G.V.Fair Grounds Avinashi Road,Coimbatore (India),India,http://rawmat.codissia.com,https://www.eventseye.com/fairs/f-raw-mat-india-28753-1.html
SALON HABITAT IMMOBILIER DÉCORATION D'ANGERS 2023,"Interior & Exterior Home Construction, Decoration, Renovation",on Sept. 2023 (?),Trade & General Public,once a year,Angers Parc Expo,Parc des Expositions 49480 Saint Sylvain d'Anjou,Angers (France),France,http://www.habitat-angers.com,https://www.eventseye.com/fairs/f-salon-habitat-immobilier-decoration-d-angers-3162-1.html
ROBAU 2023,Construction and Property Industry Show,on Sept. 2023 (?),Trade & General Public,once a year,HanseMesse Rostock,Zur HanseMesse 1-2 18106 Rostock,Rostock (Germany),Germany,http://www.inrostock.de/messen/robau-rostocker-baumesse/?lang=en,https://www.eventseye.com/fairs/f-robau-16661-1.html
SALON MAISON DÉCO 2023,"Exhibition of decoration and habitat. Maison Déco lounge revolves around the themes of housing, decoration, real estate, wooden houses, nature and the garden as well as crafts",on Sept. 2023 (?),Trade & General Public,once a year,Parc des expositions de Rouen,Le Madrillet 76120 Le Grand Quevilly,Rouen (France),France,http://www.salonmaisondeco.com,https://www.eventseye.com/fairs/f-salon-maison-deco-22172-1.html
SALON MÉTAMORPHOSES 2023,"Exhibition of innovative materials. Creators, producers and users of innovative materials and products will exhibit their know-how in sectors as varied as textiles, construction, recycling, digital technology, chemicals...",on Sept. 2023 (?),Trade Public,every 2 years,Wallonie Expo,"Zone de la Famenne Rue des Deux Provinces, n° 1",Marche-en-Famenne (Belgium),Belgium,http://www.salon-metamorphoses.be,https://www.eventseye.com/fairs/f-salon-metamorphoses-22054-1.html
STROYTECH – THE CITY 2023,"International Exhibition of Building Materials, Machines and Technologies",on Sept. 2023 (?),Trade Public,once a year,International Fair Plovdiv,"37, Tzar Boris III Obedinitel Blvd",Plovdiv (Bulgaria),Bulgaria,http://www.fair.bg/en,https://www.eventseye.com/fairs/f-stroytech-the-city-8044-1.html
SIBERIAN BEAUTY WEEK 2023,"Exhibition of Cosmetics, Equipment and Materials for the Beauty Industry",on Sept. 2023 (?),Trade & General Public,once a year,Novosibirsk Expocentre,"Stantsionnaya Street, 104 630071, Novosibirsk",Novosibirsk (Russia),Russia,http://sbeautyweek.com,https://www.eventseye.com/fairs/f-siberian-beauty-week-27119-1.html
SODEX ANKARA 2023,"Heating, Ventilation, Air-Conditioning & Refrigeration Exhibition",on Sept. 2023 (?),Trade Public,every 3 years,Congresium Ankara,Sögütözü Caddesi No:1/A  06510 Çankaya,Ankara (Turkey),Turkey,http://www.sodexankara.com,https://www.eventseye.com/fairs/f-sodex-ankara-17497-1.html
WESTCHESTER FALL HOME SHOW 2023,"Westchester, NY Home Show. If you’re planning on remodeling or renovating your home, this is the home improvement event you can’t afford to miss",on Sept. 2023 (?),Trade & General Public,once a year,Westchester County Center,198 Central Avenue Route 119 at Central Ave,"Westchester, NY (USA)",USA,http://www.jenksproductions.com/event/westchester-fall-home-show,https://www.eventseye.com/fairs/f-westchester-fall-home-show-29537-1.html
SRI LANKA WOOD 2023,International Wood Industry Exhibition in Sri Lanka,on Sept. 2023 (?),Trade Public,once a year,BMICH (Bandaranaike Memorial International Conference Hall),Colombo 7 Bandaranayaka,Colombo (Sri Lanka),Sri Lanka,http://www.srilankawood.com,https://www.eventseye.com/fairs/f-sri-lanka-wood-22968-1.html
NOVAFLEUR 2023,Annual national meeting of professionals in the flower industry and florist artisans,"Oct. 01 - 02, 2023",Trade Public,once a year,Parc des expositions de Tours,Avenue Jacques Duclos 37042 Tours,Tours (France),France,http://www.novafleur.fr,https://www.eventseye.com/fairs/f-novafleur-21013-1.html
SHS - ASIA INTERNATIONAL SMART HOME EXPO 2023,Asia International Smart Home Expo,on Sept. 2023 (?),Trade Public,once a year,Western China International Expo City,"No. 88, East Section of Fuzhou Road Tianfu New District",Chengdu (China),China,http://www.shbshow.com/index.php?lang=en,https://www.eventseye.com/fairs/f-shs-asia-international-smart-home-expo-27958-1.html
SALON DE LA MAISON DE TARBES 2023,Home Fair of Tarbes. More than 100 real estate and housing specialists,"Oct. 14 - 16, 2022",Trade & General Public,once a year,Tarbes - Parc des Expositions,Bd. Kennedy 65000 Tarbes,Tarbes (France),France,http://www.tarbes-expos.com/evenements,https://www.eventseye.com/fairs/f-salon-de-la-maison-de-tarbes-28534-1.html
ADANA FURNITURE - DECORATION FAIR 2023,"Home and Office Furnitures, Decoration, Lighting, Glassware, Carpet, Home textile, Garden, Home Electronics and Accessories Fair","Oct. 02 - 07, 2023",Trade & General Public,once a year,Tüyap Adana International Exhibition and Congress Center,"Seyhan Mahallesi, Turgut Özal Blv 100 Yil - Adana",Adana (Turkey),Turkey,http://adanamobilyafuari.com/en,https://www.eventseye.com/fairs/f-adana-furniture-decoration-fair-11512-1.html
UWT CHINA 2023,Urban Water Treatment Expo. UWT China is the leading international trade fair for urban water and wastewater treatment in Asia,on Sept. 2023 (?),Trade Public,once a year,Shanghai New International Expo Centre,"2345 Longyang Road, Pudong New Area Shanghai P.R.C. 201204",Shanghai (China),China,http://www.uwtchina.com,https://www.eventseye.com/fairs/f-uwt-china-22953-1.html
CONGRÈS INTERNATIONAL DE L'AFTES 2023,The French Tunnelling and Underground Space Association (AFTES) International Congess & Expo,"Oct. 02 - 04, 2023",Trade Public,every 2 years,Palais des Congrès de Paris Porte Maillot,"2, place de la Porte Maillot 75583 Paris Cedex 17",Paris (France),France,http://www.aftes.asso.fr/congres-aftes.html,https://www.eventseye.com/fairs/f-congres-international-de-l-aftes-21122-1.html
BOILERS & BURNERS 2023,Boilers and Burners Expo,"Oct. 03 - 06, 2023",Trade Public,once a year,ExpoForum Convention and Exhibition Centre,"64/1, Peterburgskoye Shosse St. Petersburg",St. Petersburg (Russia),Russia,http://www.en.farexpo.ru/boiler,https://www.eventseye.com/fairs/f-boilers-burners-9898-1.html
ENERGY-SAVING. POWER EFFICIENCY. INNOVATIVE TECHNOLOGIES AND EQUIPMENT 2023,"International Specialized Exhibition of Energy-Saving, Power Efficiency, Innovative Technologies and Equipment","Oct. 03 - 06, 2023",Trade Public,once a year,ExpoForum Convention and Exhibition Centre,"64/1, Peterburgskoye Shosse St. Petersburg",St. Petersburg (Russia),Russia,http://www.en.farexpo.ru/energy/exhibition/about,https://www.eventseye.com/fairs/f-energy-saving.-power-efficiency.-innovative-technologies-and-equipment-25336-1.html
ZAK WORLD OF FAÇADES - SAUDI ARABIA - JEDDAH 2023,Zak World of Façades is an International conference series on façade design & engineering,"on Oct. 03, 2023",Trade Public,once a year,"Ritz-Carlton, Jeddah","Al Hamra District Jeddah, 21493",Jeddah (Saudi Arabia),Saudi Arabia,http://zakworldoffacades.com,https://www.eventseye.com/fairs/f-zak-world-of-facades-saudi-arabia-jeddah-27599-1.html
AQUA-THERM TASHKENT 2023,"International Exhibition of Heating, Ventilation, Air-conditioning, Water Supply, Sanitary, Environmental Technology, Swimming Pool and Renewable Energies","Oct. 04 - 06, 2023",Trade Public,once a year,Uzexpocentre,"107, Amir Temur street Tashkent, 700084",Tashkent (Uzbekistan),Uzbekistan,http://www.aquatherm-tashkent.uz/en,https://www.eventseye.com/fairs/f-aqua-therm-tashkent-16783-1.html
INTERSEC SAUDI ARABIA 2023,"Saudi Arabia’s leading regional trade fair for security, safety and fire protection","Oct. 03 - 05, 2023",Trade Public,once a year,Riyadh International Exhibition Centre,Riyadh,Riyadh (Saudi Arabia),Saudi Arabia,http://intersec-ksa.ae.messefrankfurt.com/ksa/en.html,https://www.eventseye.com/fairs/f-intersec-saudi-arabia-27546-1.html
IBERFLORA 2023,"International Fair or Horticulture, Forestry & Florist. Gardening, Town Planning & Landscaping Show. Horticultural Technology Show","Oct. 03 - 05, 2023",Trade Public,once a year,Feria Valencia,Avenida de la ferias s/n E-46035 Valencia,Valencia (Spain),Spain,http://iberflora.feriavalencia.com,https://www.eventseye.com/fairs/f-iberflora-4625-1.html
SIM SENEGAL 2023,Senegalese Mining Conference & Exhibition,"Oct. 03 - 05, 2023",Trade Public,once a year,CICAD - Centre International de Conférences Abdou Diouf,Rufisque,Dakar (Senegal),Senegal,http://www.simsenegal.com,https://www.eventseye.com/fairs/f-sim-senegal-17273-1.html
POWER EFFICIENCY. ENERGY-SAVING. INNOVATIVE TECHNOLOGIES AND EQUIPMENT 2023,"Energy efficiency and energy saving in transportation of energy resources and generation of heat and electricity, Energy saving technology in engineering systems, Energy efficient equipment, devices, products and materials…","Oct. 03 - 06, 2023",Trade Public,once a year,ExpoForum Convention and Exhibition Centre,"64/1, Peterburgskoye Shosse St. Petersburg",St. Petersburg (Russia),Russia,http://www.en.farexpo.ru/energy,https://www.eventseye.com/fairs/f-power-efficiency.-energy-saving.-innovative-technologies-and-equipment-15455-1.html
FESTIVAL BREIZH TRANSITION 2023,Energy Transition and Sustainable Development Festival,"Oct. 04 - 05, 2023",Trade & General Public,every 2 years,Parc des expositions Quimper Cornouaille,"32 bis, rue Stang Bihan 29000 Quimper",Quimper (France),France,http://www.breizh-transition.bzh,https://www.eventseye.com/fairs/f-festival-breizh-transition-21927-1.html
GRAND DESIGNS LIVE - BIRMINGHAM 2023,"Grand Designs Live features the latest in ideas, innovation and home project guidance. Build, Kitchens & Bathrooms, Gardens and Interiors","Oct. 04 - 08, 2023",Trade & General Public,once a year,National Exhibition Centre,Birmingham B40 1NT,Birmingham (UK - United Kingdom),UK - United Kingdom,http://www.granddesignslive.com,https://www.eventseye.com/fairs/f-grand-designs-live-birmingham-28725-1.html
UK CONSTRUCTION WEEK (UKCW) - BIRMINGHAM 2023,"UK’s Largest Construction and building industry Exhibition. UK Construction Week showcases Building Materials & Products, Tools, Software, Roofing, Flooring, Plastering, Windows, Doors and Anything related to construction","Oct. 03 - 05, 2023",Trade Public,once a year,National Exhibition Centre,Birmingham B40 1NT,Birmingham (UK - United Kingdom),UK - United Kingdom,http://www.ukconstructionweek.com,https://www.eventseye.com/fairs/f-uk-construction-week-(ukcw)-birmingham-23288-1.html
INMEX INDIA 2023,"International Maritime Industry Expo. INMEX will enable you to meet with serious buyers from the industry, boost your brand in front of thousands of maritime and shipping professionalsNetwork with government and industry authorities, launch new products","Oct. 04 - 06, 2023",Trade Public,every 2 years,Bombay Convention & Exhibition Centre (BCEC),"Highway, Goreagon (East) Mumbai - 400 063",Mumbai (India),India,http://www.inmexindia.com,https://www.eventseye.com/fairs/f-inmex-india-10005-1.html
PAINTEXPO EURASIA 2023,International Trade Fair for Industrial Coating Technology,"Oct. 04 - 06, 2023",Trade Public,every 2 years,Istanbul Expo Center / Istanbul Fuar Merkezi / CNR Expo,"Atatürk Havalimani Karsisi 34149 Yesilköy, Istanbul",Istanbul (Turkey),Turkey,http://www.paintexpo.com.tr,https://www.eventseye.com/fairs/f-paintexpo-eurasia-21044-1.html
SMM INDIA 2023,Most Comprehensive Exhibition on the Indian Maritime Industry - Shipbuilding - Marine Technology,"Oct. 04 - 06, 2023",Trade Public,every 2 years,Bombay Convention & Exhibition Centre (BCEC),"Highway, Goreagon (East) Mumbai - 400 063",Mumbai (India),India,http://inmex-smm-india.com,https://www.eventseye.com/fairs/f-smm-india-12439-1.html
BAUEN + WOHNEN LUZERN 2023,"Swiss Fair for Home Modernization, home refurbishment and home renovation","Oct. 05 - 08, 2023",Trade & General Public,once a year,Messe Luzern - Centre d'exposition de l'Allmend,Horwerstrasse 87 CH-6005 Luzern,Lucerne (Switzerland),Switzerland,http://www.messe-luzern.ch,https://www.eventseye.com/fairs/f-bauen-wohnen-luzern-4428-1.html
IRAN HVAC&R 2023,"HVAC Trade Show. Heating Systems and Equipment, Air Conditioning Ventilation Systems and Equipment, Refrigeration Systems and Components","Oct. 05 - 08, 2023",Trade Public,once a year,Tehran Permanent Fairground,Dr. Chamran Highway Tadjrish,Tehran (Iran),Iran,http://www.iranhvac.com/en,https://www.eventseye.com/fairs/f-iran-hvac-r-20897-1.html
SEGURIDAD EXPO 2023,International Exhibition on Comprehensive Security,"Oct. 05 - 07, 2023",Trade Public,once a year,Parque Fisa,Ruta 68 KM 16 Pudahuel,Santiago (Chile),Chile,http://www.seguridadexpo.cl,https://www.eventseye.com/fairs/f-seguridad-expo-25908-1.html
BUSWORLD SOUTH EAST ASIA JAKARTA 2023,Indonesia International Bus Exhibition,"Oct. 05 - 07, 2023",Trade Public,once a year,Jakarta International Expo (JIExpo),Gedung Pusat Niaga Lt. 1 Arena PRJ Kemayoran,Jakarta (Indonesia),Indonesia,http://www.busworldsoutheastasia.org/en,https://www.eventseye.com/fairs/f-busworld-south-east-asia-jakarta-28439-1.html
ACETECH - BENGALURU 2023,"Exhibition dedicated solely to the Construction Industry. ACETECH is a leading trade fair in Asia for architecture, building materials, innovation and design","Oct. 06 - 08, 2023",Trade Public,once a year,Bengaluru Palace,Vasanth Nagar Bengaluru,Bangalore (India),India,http://www.etacetech.com,https://www.eventseye.com/fairs/f-acetech-bengaluru-15929-1.html
ENERGY FAIR MONTENEGRO 2023,"Trade show dedicated to energy, energy efficiency and energy savings measures","Oct. 05 - 07, 2023",Trade Public,once a year,Adriatic Fair,Ad Jadranski Sajam Trg Slobode,Budva (Montenegro),Montenegro,http://www.adriafair.co.me/en,https://www.eventseye.com/fairs/f-energy-fair-montenegro-22798-1.html
CIVIL ENGINEERING FAIR 2023,"Montenegro Civil Engeneering Fair. Achievements and inovative solutions from all construction fields: building construction, civil engineering construction, building maintenance, fittings &joinery, engineering and design, interior & exterior solutions...","Oct. 05 - 07, 2023",Trade Public,once a year,Adriatic Fair,Ad Jadranski Sajam Trg Slobode,Budva (Montenegro),Montenegro,http://www.adriafair.co.me/en,https://www.eventseye.com/fairs/f-civil-engineering-fair-28026-1.html
ARENA OF BEAUTY 2023,"National hairdressing, cosmetics, manicure, pedicure, SPA & Wellness exhibition","Oct. 06 - 08, 2023",Trade Public,once a year,Inter Expo Center,"147 Tsarigradsko Shaussee 1784, Sofia",Sofia (Bulgaria),Bulgaria,http://www.arenaofbeauty.bg/en,https://www.eventseye.com/fairs/f-arena-of-beauty-15397-1.html
FIRE INDIA 2023,"International Fire, Rescue and Emergency Expo","Oct. 05 - 07, 2023",Trade Public,once a year,Bombay Convention & Exhibition Centre (BCEC),"Highway, Goreagon (East) Mumbai - 400 063",Mumbai (India),India,http://fireindia.net,https://www.eventseye.com/fairs/f-fire-india-16440-1.html
DESERET NEWS HOME SHOW 2023,"Deseret, UT NEWS HOME SHOW features trendy furniture, home furnishings, new interior designs, remodelling and revamp","Oct. 06 - 08, 2023",Trade & General Public,once a year,Mountain America Expo Center,"9575 State St Sandy, UT 84070","Sandy, UT (USA)",USA,http://www.deseretnewshomeshow.com,https://www.eventseye.com/fairs/f-deseret-news-home-show-10346-1.html
IREIS - INTERNATIONAL REAL ESTATE & INVESTMENT SHOW 2023,Exclusive International Exhibition for Real Estate & Investment Companies to meet with Home Buyers and Investors,"Oct. 06 - 07, 2023",Trade Public,once a year,Conrad Etihad Towers,West Corniche Rd Al Bateen,Abu Dhabi (UAE - United Arab Emirates),UAE - United Arab Emirates,http://www.realestateshow.ae,https://www.eventseye.com/fairs/f-ireis-international-real-estate-investment-show-7562-1.html
SALON DE L'HABITAT & JARDIN D'ALENÇON 2023,"Home & Garden Show in Alençon. Construction, renovation, equipment, interior and exterior design","Oct. 06 - 08, 2023",Trade & General Public,once a year,Anova Parc des Expositions,"171, Rue de Bretagne 61000 Alençon",Alencon (France),France,http://leopro.fr/salon-habitat-alencon,https://www.eventseye.com/fairs/f-salon-de-l-habitat-jardin-d-alencon-28685-1.html
SALON DE L'HABITAT D'AVIGNON 2023,Avignon Home and Real Estate Show,"Oct. 06 - 08, 2023",Trade & General Public,once a year,Parc des expositions - Avignon Sud,84000 Avignon,Avignon (France),France,http://www.deficom-evenements.fr/prochains-salons,https://www.eventseye.com/fairs/f-salon-de-l-habitat-d-avignon-28701-1.html
VIVING BREST 2023,Home Construction & Home Design Show,"Oct. 06 - 09, 2023",Trade & General Public,once a year,Parc des expositions Penfeld,29275 Brest Cedex 1,Brest (France),France,http://www.viving.fr/brest,https://www.eventseye.com/fairs/f-viving-brest-15669-1.html
