Name Event,Description,Date,Audience,Cycle,Veneu,Address,City ,Country,Website,Link
ARCHITECT @ WORK - UNITED KINGDOM 2023,"Exhibition for Architecture & Interior Design. ARCHITECT@WORK gives you the opportunity to get into contact with: architects, interior architects, designers, engineering bureaus, project developers, technical services, towns & district councils","March 22 - 23, 2023",Trade Public,once a year,The Truman Brewery,91 Brick Ln London E1 6QR,London (UK - United Kingdom),UK - United Kingdom,http://www.architect-at-work.co.uk,https://www.eventseye.com/fairs/f-architect-@-work-united-kingdom-19581-1.html
CONECO - RACIOENERGIA 2023,International Construction Fair and International Fair of Rationalisation of Energy,"March 22 - 25, 2023",Trade Public,once a year,Bratislava Exhibition Ground,Viedenská cesta c. 7 852 51 Bratislava 5,Bratislava (Slovakia),Slovakia,http://www.incheba.sk/en,https://www.eventseye.com/fairs/f-coneco-racioenergia-499-1.html
AMBIENT EXPO 2023,"International Trade Fair of Products and Systems for Interior & Outdoor Decoration, Furniture and Swimmming Pools","March 23 - 26, 2023",Trade & General Public,once a year,Romexpo,65-67 Marasti Blvd. 71331 Bucharest,Bucharest (Romania),Romania,http://construct-ambientexpo.ro/en,https://www.eventseye.com/fairs/f-ambient-expo-15350-1.html
"DACHA, GARDEN, LANDSCAPE, SMALL-SCALE MECHANIZATION 2023","Dacha, Garden, Landscape, Small-scale mechanization","March 22 - 26, 2023",Trade & General Public,once a year,VDNH Exhibition Center,VDNH Estate 119 Prospect Mira,Moscow (Russia),Russia,http://www.dacha.interopttorg.ru,https://www.eventseye.com/fairs/f-dacha-garden-landscape-small-scale-mechanization-20915-1.html
ECOLOGY OF BIG CITY 2023,"Specialized Exhibition of Constructions and Means for Water & Air Basins' Protection, Equipment for Waste Processing","March 22 - 24, 2023",Trade Public,once a year,ExpoForum Convention and Exhibition Centre,"64/1, Peterburgskoye Shosse St. Petersburg",St. Petersburg (Russia),Russia,http://ecology.expoforum.ru/en,https://www.eventseye.com/fairs/f-ecology-of-big-city-4006-1.html
"CHINA BEIJING INTERNATIONAL GIFTS, PREMIUM & HOUSEWARE EXHIBITION 2023","International Gifts, Premium & Houseware Fair","March 23 - 25, 2023",Trade & General Public,twice a year,China International Exhibition Centre (CIEC),6 East Beisanhuan Road Chaoyang District,Beijing (China),China,http://www.giftsbeijing.com,https://www.eventseye.com/fairs/f-china-beijing-international-gifts-premium-houseware-exhibition-20071-1.html
FLOWER SPRING / AUTUMN 2023,"Specialized Exhibition of Flowers, Ornamental Plants, Garden Equipment and Supplies","March 22 - 26, 2023",Trade Public,twice a year,International Fair Plovdiv,"37, Tzar Boris III Obedinitel Blvd",Plovdiv (Bulgaria),Bulgaria,http://www.fair.bg/en,https://www.eventseye.com/fairs/f-flower-spring-autumn-2985-1.html
SA MAJOR PROJECTS CONFERENCE 2023,"South Australia's largest major projects & infrastructure conference attracting over 200 delegates each year. Topics covered - Transport, housing, health, education, energy & water","March 22 - 23, 2023",Trade Public,once a year,Adelaide Convention Centre,North Terrace Adelaide,Adelaide (Australia),Australia,http://www.expotradeglobal.com/events/samajorprojects,https://www.eventseye.com/fairs/f-sa-major-projects-conference-26797-1.html
COMFORTHOME 2023,"Exhibition for heating, energy efficiency, comfort technologies and finishing solutions","March 23 - 26, 2023",Trade & General Public,once a year,Riga International Exhibition Centre,"Kipsalas str 8 Riga, LV-1048",Riga (Latvia),Latvia,http://www.comforthome.lv/eng,https://www.eventseye.com/fairs/f-comforthome-27916-1.html
CONSTRUCT EXPO 2023,"International fair for construction technologies, installation, equipment and materials","March 23 - 26, 2023",Trade Public,once a year,Romexpo,65-67 Marasti Blvd. 71331 Bucharest,Bucharest (Romania),Romania,http://construct-ambientexpo.ro/en,https://www.eventseye.com/fairs/f-construct-expo-8155-1.html
STYLE FAIR 2023,International trade fair of lifestyle products. It combines. - Bangkok Intl Fashion Fair & Bangkok Intl Leather Fair (BIFF & BIL),"March 22 - 26, 2023",Trade & General Public,once a year,Bangkok International Trade & Exhibition Centre (BITEC),"8 Bangna-Trad Road (Km.1), Bangna Bangkok 10260",Bangkok (Thailand),Thailand,http://www.stylebangkokfair.com,https://www.eventseye.com/fairs/f-style-fair-285-1.html
EDMONTON HOME + GARDEN SHOW 2023,Edmonton Home & Garden Show,"March 23 - 26, 2023",Trade Public,once a year,Edmonton Expo Centre,"7515 - 118 Avenue Edmonton, Alberta T5B 4X5","Edmonton, AB (Canada)",Canada,http://www.edmontonhomeshow.com,https://www.eventseye.com/fairs/f-edmonton-home-garden-show-4371-1.html
EXPO FLOWERS & GARDEN 2023,"International exhibition for flower business, landscape design, horticulture and gardening","March 23 - 26, 2023",Trade Public,once a year,Romexpo,65-67 Marasti Blvd. 71331 Bucharest,Bucharest (Romania),Romania,http://www.expoflowers.ro,https://www.eventseye.com/fairs/f-expo-flowers-garden-16635-1.html
GREEN DAYS 2023,Warsaw Gardening and Landscaping Fair,"March 23 - 25, 2023",Trade & General Public,once a year,Ptak Warsaw Expo,62 Katowicka Ave. 05-830 Nadarzyn,Warsaw (Poland),Poland,http://greendaysexpo.com/en,https://www.eventseye.com/fairs/f-green-days-25423-1.html
HOME. APARTMENT 2023,"Architecture, Design and Reconstruction of Apartments. Repairs and Refurbishment. Finishing and Decoration Materials. Plumbing and Thermo Techniques. Lighting. Home Security and Alarm Systems. Consumer Electronics, Electric Appliances and Equipment","March 23 - 26, 2023",Trade Public,once a year,Riga International Exhibition Centre,"Kipsalas str 8 Riga, LV-1048",Riga (Latvia),Latvia,http://www.bt1.lv/maja1/eng,https://www.eventseye.com/fairs/f-home.-apartment-6619-1.html
OTTAWA HOME & GARDEN SHOW 2023,"Ottawa, ON Home & Garden Show. Innovative Products and Hundreds of Experts all Under One Roof","March 23 - 26, 2023",Trade & General Public,once a year,Ernst & Young Centre,4899 Uplands Drive Ottawa ON K1V 2N6,"Ottawa, ON (Canada)",Canada,http://ottawahomeshow.com,https://www.eventseye.com/fairs/f-ottawa-home-garden-show-14699-1.html
POOL + GARDEN TULLN 2023,Pool & Garden Trade Expo,"March 23 - 26, 2023",Trade & General Public,once a year,Messe Tulln,Messegelände A-3430 Tulln,Tulln (Austria),Austria,http://www.messe-tulln.at/messe-kalender/pool-garden-tulln,https://www.eventseye.com/fairs/f-pool-garden-tulln-25322-1.html
HOUSE - MÂJA 2023,International Building Industry Trade Fair. Architecture. Design. Planning. Reconstruction. Building machinery and materials. Plumbing and thermal engineering. Lighting and wiring. Home technology & equipment. Environmentally safe construction,"March 23 - 26, 2023",Trade Public,once a year,Riga International Exhibition Centre,"Kipsalas str 8 Riga, LV-1048",Riga (Latvia),Latvia,http://www.bt1.lv/maja1/eng,https://www.eventseye.com/fairs/f-house-maja-9259-1.html
ROMTHERM 2023,"International Exhibition of Heating, Cooling, Air Conditioning and Insulating Equipment","March 23 - 26, 2023",Trade Public,once a year,Romexpo,65-67 Marasti Blvd. 71331 Bucharest,Bucharest (Romania),Romania,http://www.romtherm.ro/en,https://www.eventseye.com/fairs/f-romtherm-2301-1.html
JLC LIVE NORTHWEST 2023,Construction Show exclusively serving the residential sector in New England. Thousands of residential construction professionals from across New England come to JLC LIVE to perfect their skills and build their businesses,"March 23 - 25, 2023",Trade Public,once a year,Rhode Island Convention Center Providence,1 Sabin Street Providence,"Providence, RI (USA)",USA,http://www.jlclive.com,https://www.eventseye.com/fairs/f-jlc-live-northwest-17915-1.html
NATIONAL HOMEBUILDING AND RENOVATING SHOW 2023,"UK's biggest, dedicated self-build & renovation event. National Homebuilding & Renovating Show is packed with free expert advice, inspirational ideas & cutting edge and essential products - all to help you make the most of your home, budget & plans","March 23 - 26, 2023",Trade & General Public,once a year,National Exhibition Centre,Birmingham B40 1NT,Birmingham (UK - United Kingdom),UK - United Kingdom,http://national.homebuildingshow.co.uk,https://www.eventseye.com/fairs/f-national-homebuilding-and-renovating-show-6818-1.html
"SALON MAISONS ET RÉNOVATION D'OTTAWA, 2023",Ottawa Home & Remodelling Trade Show,"March 23 - 26, 2023",Trade & General Public,once a year,Ernst & Young Centre,4899 Uplands Drive Ottawa ON K1V 2N6,"Ottawa, ON (Canada)",Canada,http://ottawahomeshow.com,https://www.eventseye.com/fairs/f-salon-maisons-et-renovation-d-ottawa-26074-1.html
KULINAR TULLN 2023,Tulln Gastronomy Fair,"March 23 - 26, 2023",Trade & General Public,once a year,Messe Tulln,Messegelände A-3430 Tulln,Tulln (Austria),Austria,http://www.messe-tulln.at/messe-kalender/kulinar-tulln,https://www.eventseye.com/fairs/f-kulinar-tulln-23579-1.html
WARSAW BUILD EXPO 2023,"Warsaw Build is an architecture and finishing materials fair where we focus on innovation in construction, architecture and design – all in international concept","March 23 - 25, 2023",Trade Public,once a year,Ptak Warsaw Expo,62 Katowicka Ave. 05-830 Nadarzyn,Warsaw (Poland),Poland,http://warsawbuild.eu/en,https://www.eventseye.com/fairs/f-warsaw-build-expo-28228-1.html
WARSAW GIFT & DECO SHOW 2023,"Central Eastern Europe’s newest and largest trade show dedicated to gifts, toys, decorations, home products, handicraft and office supplies","March 23 - 25, 2023",Trade Public,once a year,Ptak Warsaw Expo,62 Katowicka Ave. 05-830 Nadarzyn,Warsaw (Poland),Poland,http://warsawgiftshow.com/en,https://www.eventseye.com/fairs/f-warsaw-gift-deco-show-26344-1.html
AUSTIN SPRING HOME + GARDEN SHOW 2023,"The Austin, TX Home & Garden Show is the place for you to experience what's new in remodelling, gardening, decorating and anything related to your home & garden","March 24 - 26, 2023",Trade & General Public,once a year,Palmer Events Center,"900 Barton Springs Rd Austin, TX 78704","Austin, TX (USA)",USA,http://austinspringhomeandgardenshow.com,https://www.eventseye.com/fairs/f-austin-spring-home-garden-show-28298-1.html
CLEVELAND HOME + REMODELING EXPO 2023,"Cleveland, OH HOME + REMODElLING SHOW features trendy furniture, home furnishings, new interior designs, remodelling and revamp","March 24 - 26, 2023",Trade & General Public,once a year,Cleveland - I-X Center,"6200 Riverside Drive Cleveland, Ohio 44135","Cleveland, OH (USA)",USA,http://homeandremodelingexpo.com,https://www.eventseye.com/fairs/f-cleveland-home-remodeling-expo-28300-1.html
BAUMESSE MÖNCHENGLADBACH 2023,"Home, Construction, Renovation & Energy Savings Expo","March 24 - 26, 2023",Trade & General Public,once a year,Messegelände Nordpark,Regentenstraße 21 41061 Mönchengladbach,Mönchengladbach (Germany),Germany,http://www.baumesse.de/moenchengladbach,https://www.eventseye.com/fairs/f-baumesse-monchengladbach-24854-1.html
DENVER HOME SHOW 2023,"Home decoration, remodelling & gardening Show. Denver Home Show is the place where you will find fresh ideas and smart advice for gardening, home improvement & decorating","March 24 - 26, 2023",Trade & General Public,once a year,National Western Complex,"4655 Humboldt Street Denver, CO 80216","Denver, CO (USA)",USA,http://denverhomeshow.com,https://www.eventseye.com/fairs/f-denver-home-show-14701-1.html
BAUEN & WOHNEN - MÜNSTER 2023,"Building & Living Exhibition. The event presents all topics relating to building, renovation, furnishing and design","March 24 - 26, 2023",Trade Public,once a year,Halle Münsterland,Albersloher Weg 32 48155 Münster,Münster (Germany),Germany,http://muenster.bau-messen.de,https://www.eventseye.com/fairs/f-bauen-wohnen-munster-9867-1.html
ECO CASA ENERGY 2023,"Renewable Energy, Energy Saving and Green Building Exhibition","March 24 - 26, 2023",Trade Public,once a year,Pordenone Fiere,Viale Treviso 1 33170 Pordenone,Pordenone (Italy),Italy,http://www.ecocasa.pn,https://www.eventseye.com/fairs/f-eco-casa-energy-26747-1.html
CANTERBURY HOME SHOW 2023,Home and Garden related Products and Services Exhibition,"March 24 - 26, 2023",Trade & General Public,once a year,Horncastle Arena,55 Jack Hinton Drive  Christchurch 8024,Christchurch (New Zealand),New Zealand,http://www.canterburyhomeshow.co.nz,https://www.eventseye.com/fairs/f-canterbury-home-show-10132-1.html
BOIS & HABITAT 2023,Wooden Construction and New Energies Exhibition,"March 24 - 27, 2023",Trade Public,once a year,Namur expo,Avenue Sergent Vrithoff 2 5000 Namur,Namur (Belgium),Belgium,http://www.bois-habitat.be/en,https://www.eventseye.com/fairs/f-bois-habitat-5877-1.html
GOLF WORLD PRAGUE 2023,Golf and Tourism Fair focused on Oolf,"March 24 - 26, 2023",Trade & General Public,once a year,PVA Letnany - Prague Exhibition Centre Letnany,"Beranovych 667 199 00, Prague 9",Prague (Czech Republic),Czech Republic,http://www.golfshow.cz,https://www.eventseye.com/fairs/f-golf-world-prague-11683-1.html
CHRISTCHURCH HOME SHOW 2023,"Renovating and Building expo. Christchurch Home Show showcases the latest building, renovation, kitchen and bathroom, furnishing, outdoor and sustainable living products","March 24 - 26, 2023",Trade & General Public,once a year,Horncastle Arena,55 Jack Hinton Drive  Christchurch 8024,Christchurch (New Zealand),New Zealand,http://www.canterburyhomeshow.co.nz,https://www.eventseye.com/fairs/f-christchurch-home-show-24621-1.html
GREENSBORO IDEAL HOME SHOW 2023,"Greensboro, NC IDEAL HOME SHOW presents latest styles of furniture, bend new interior designs, remodelling, trendy furnishings and patio instalation","March 24 - 26, 2023",Trade & General Public,once a year,Greensboro Coliseum Complex,"1921 W. Lee Street Greensboro, NC 27403","Greensboro, NC (USA)",USA,http://greensboroidealhomeshow.com,https://www.eventseye.com/fairs/f-greensboro-ideal-home-show-28283-1.html
IDEAL HOME SHOW CANADA 2023,"Atlantic Canada’s largest home show, featuring Nova Scotia’s construction and renovation leaders. Showcase for indoor and outdoor living","March 24 - 26, 2023",Trade & General Public,once a year,Halifax Exhibition Centre,"200 Prospect Rd Goodwood, NS B3T 1P2","Halifax, NS (Canada)",Canada,http://www.springideal.ca,https://www.eventseye.com/fairs/f-ideal-home-show-canada-17105-1.html
IMMO MESSE SCHWEIZ 2023,"Real Estate Fair. Property, environment, energy, construction and renovation","March 24 - 26, 2023",Trade & General Public,once a year,Olma Messen St. Gallen,Splügenstrasse 12 CH-9008 St.Gallen,St. Gallen (Switzerland),Switzerland,http://www.immomesse.ch,https://www.eventseye.com/fairs/f-immo-messe-schweiz-19019-1.html
SPRING IDEAL HOME SHOW 2023,Home Show,"March 24 - 26, 2023",Trade & General Public,once a year,Halifax Exhibition Centre,"200 Prospect Rd Goodwood, NS B3T 1P2","Halifax, NS (Canada)",Canada,http://www.springideal.ca,https://www.eventseye.com/fairs/f-spring-ideal-home-show-12228-1.html
JLC LIVE NEW ENGLAND 2023,Residential Construction Show & conference exclusively serving the residential sector in New England. JLC LIVE attracts thousands of residential construction professionals from New England come to JLC LIVE to perfect their skills & build their businesses,"March 24 - 25, 2023",Trade Public,once a year,Rhode Island Convention Center Providence,1 Sabin Street Providence,"Providence, RI (USA)",USA,http://events.informamarkets.com/en/event-listing.html,https://www.eventseye.com/fairs/f-jlc-live-new-england-14096-1.html
KENYA TRADE SHOW 2023,"Kenya Trade Show. KENYA TRADE SHOW features Automotive, IT, Electronics, Building, Construction, Medical, Pharamaceutical, Food, Hotel Supplies, Consumer, Household, Industrial Machinery, Safety, Security, Printing, Packaging","March 24 - 26, 2023",Trade & General Public,once a year,The Sarit Centre,00800 Nairobi,Nairobi (Kenya),Kenya,http://www.growexh.com/kenyatradeshow,https://www.eventseye.com/fairs/f-kenya-trade-show-20461-1.html
NEW ENGLAND HOME SHOW - FOXBORO 2023,"Foxborough, MA Home Show","March 24 - 26, 2023",Trade & General Public,once a year,Empower Field House,"Patriot Pl Foxborough, MA 02035","Foxborough, MA (USA)",USA,http://homeshowfoxboro.com,https://www.eventseye.com/fairs/f-new-england-home-show-foxboro-24914-1.html
TOURISMA 2023,"International Archaeological Exhibition. tourismA is an opportunity for exposure, disclosure and comparison of all initiatives related to communication of ancient world and valorization of archaeological witnesses","March 24 - 26, 2023",Trade & General Public,once a year,Firenze Fiera Congress Center,Piazza Adua 1 50123 Firenze,Florence (Italy),Italy,http://www.tourisma.it,https://www.eventseye.com/fairs/f-tourisma-28970-1.html
"SALON BIEN-ÊTRE, MÉDECINE DOUCE & THALASSO - LYON 2023","Wellness, Natural Health and thalassotherapy Expo","March 24 - 26, 2023",Trade & General Public,once a year,Eurexpo,Bd de l'Europe 69680 Chassieu,Lyon (France),France,http://www.salon-medecinedouce.com/lyon,https://www.eventseye.com/fairs/f-salon-bien-etre-medecine-douce-thalasso-lyon-12130-1.html
THE OKC HOME + OUTDOOR LIVING SHOW 2023,At OKC Home + Outdoor Living Show you will find great deals and hard to find items for the home & get advice of top professionals,"March 24 - 26, 2023",Trade & General Public,once a year,OKC Fairground,"3001 General Pershing Blvd Oklahoma City, OK 73107","Oklahoma City, OK (USA)",USA,http://www.homeshowokc.com,https://www.eventseye.com/fairs/f-the-okc-home-outdoor-living-show-15171-1.html
BEAUTY TRADE SPECIAL 2023,Beauty Salon Equipment Trade Fair,"March 25 - 27, 2023",Trade Public,once a year,Jaarbeurs Utrecht,Jaarbeursplein 3521 AL Utrecht,Utrecht (Netherlands),Netherlands,http://www.beautytradespecial.nl,https://www.eventseye.com/fairs/f-beauty-trade-special-6021-1.html
SOUTHERN IDEAL HOME SHOW - GREENSBORO 2023,Building & Home Improvement Show + Garden show,"March 24 - 26, 2023",Trade & General Public,once a year,Greensboro Coliseum Complex,"1921 W. Lee Street Greensboro, NC 27403","Greensboro, NC (USA)",USA,http://www.greensboroidealhomeshow.com,https://www.eventseye.com/fairs/f-southern-ideal-home-show-greensboro-17561-1.html
XIAMEN STONE FAIR 2023,International Natural Stone Fair,"March 26 - 29, 2023",Trade Public,once a year,Xiamen International Conference & Exhibition Centre,"Exhibition Road, No. 198 Xiamen 361008",Xiamen (China),China,http://www.stonefair.org.cn,https://www.eventseye.com/fairs/f-xiamen-stone-fair-14306-1.html
BUILDINGS INDIA 2023,Indian Building Fair,"March 27 - 29, 2023",Trade Public,once a year,Pragati Maidan,Near Delhi Zoological Park Mathura Road,New Delhi (India),India,http://www.buildingsindia.com,https://www.eventseye.com/fairs/f-buildings-india-27325-1.html
CLEAN INDIA 2023,India Industrial Cleaning & Waste Management Exhibition,"March 27 - 29, 2023",Trade Public,once a year,Pragati Maidan,Near Delhi Zoological Park Mathura Road,New Delhi (India),India,http://www.cleanindiaexpo.com,https://www.eventseye.com/fairs/f-clean-india-27326-1.html
SMART CITIES INDIA EXPO 2023,"Expo dedicated to Urban Development, providing a platform that enables deeper communication and a more practical approach to resolving societal problems and offers business opportunities working toward making smart cities a reality","March 27 - 29, 2023",Trade Public,once a year,Pragati Maidan,Near Delhi Zoological Park Mathura Road,New Delhi (India),India,http://www.smartcitiesindia.com,https://www.eventseye.com/fairs/f-smart-cities-india-expo-27324-1.html
DESIGN WEEK SHANGHAI 2023,China International Building & Interior Design Forum,"March 28 - 31, 2023",Trade Public,once a year,Shanghai New International Expo Centre,"2345 Longyang Road, Pudong New Area Shanghai P.R.C. 201204",Shanghai (China),China,http://www.hdeexpo.com/en-us,https://www.eventseye.com/fairs/f-design-week-shanghai-26699-1.html
TRANSPORT INDIA 2023,"International Exhibition for Urban Transport, Secure, Efficient and Sustainable","March 27 - 29, 2023",Trade Public,once a year,Pragati Maidan,Near Delhi Zoological Park Mathura Road,New Delhi (India),India,http://www.transportindiaexpo.com,https://www.eventseye.com/fairs/f-transport-india-27328-1.html
EXPO LIGHT 2023,Lighting Industry Expo,"March 28 - 31, 2023",Trade Public,once a year,Pudong Shangri-La Shanghai Hotel,"33 Fu Cheng Road Pudong, Shanghai 200120",Shanghai (China),China,http://www.expolight.cn,https://www.eventseye.com/fairs/f-expo-light-16755-1.html
WATER INDIA 2023,"Trade show dedicated to Water Management. Water Supply & Distribution, Irrigation system, Wastewater Treatment, Solar-powered water supply, Government Initiatives...","March 27 - 29, 2023",Trade Public,once a year,Pragati Maidan,Near Delhi Zoological Park Mathura Road,New Delhi (India),India,http://www.waterindia.com,https://www.eventseye.com/fairs/f-water-india-27313-1.html
HDE - ECOBUILD CHINA 2023,Shanghai Hospitality Design & Engineering Expo + Eco-building Expo,"March 28 - 31, 2023",Trade Public,once a year,Pudong Shangri-La Shanghai Hotel,"33 Fu Cheng Road Pudong, Shanghai 200120",Shanghai (China),China,http://www.hdeexpo.com/#new_tab,https://www.eventseye.com/fairs/f-hde-ecobuild-china-7725-1.html
BUILDTECH ASIA 2023,"International Exhibition for the Building & Construction Industry in Singapore. BUILDTECH ASIA will feature the latest in construction machinery, construction vehicles & equipment, materials for building/construction, electrical & mechanical engineering","March 28 - 30, 2023",Trade Public,once a year,Singapore Expo,1 Expo Drive Singapore 486150,Singapore (Singapore),Singapore,http://www.buildtechasia.com,https://www.eventseye.com/fairs/f-buildtech-asia-14887-1.html
"CERAMICS, TILE & SANITARY WARE CHINA 2023","International Ceramics, Tile & Sanitary Ware Expo","March 28 - 31, 2023",Trade Public,once a year,Shanghai New International Expo Centre,"2345 Longyang Road, Pudong New Area Shanghai P.R.C. 201204",Shanghai (China),China,http://www.hdeexpo.com/en-us,https://www.eventseye.com/fairs/f-ceramics-tile-sanitary-ware-china-16750-1.html
HDE - SHANGHAI INTERNATIONAL HOSPITALITY DESIGN & SUPPLIES EXPO 2023,"International Hospitality Design & Supplies Expo in Shanghai. HDE provides engineering, design and overall project solutions to hotels, clubs, resorts, bars, chambers, villas, and correlated engineering businesses","March 28 - 31, 2023",Trade Public,once a year,Nanjing International Expo Center,Nanjing,Nanjing (China),China,http://www.hdeexpo.com,https://www.eventseye.com/fairs/f-hde-shanghai-international-hospitality-design-supplies-expo-19559-1.html
CHINA CLEAN EXPO - CCE SHANGHAI 2023,"Cleaning Expo. International Indoor Environment Technology & Product Exhibitio. CHINA CLEAN EXPO showcases a wide range of products from commercial cleaning, industry cleaning, public cleaning, municipal cleaning and personal and home care","March 28 - 31, 2023",Trade Public,once a year,Shanghai New International Expo Centre,"2345 Longyang Road, Pudong New Area Shanghai P.R.C. 201204",Shanghai (China),China,http://www.chinacleanexpo.com/en-us/home,https://www.eventseye.com/fairs/f-china-clean-expo-cce-shanghai-13450-1.html
HDE + EXPOBUILD CHINA 2023,Shanghai Hospitality Design & Engineering Expo - Building Expo for Commercial Properties,"March 28 - 31, 2023",Trade Public,once a year,Shanghai New International Expo Centre,"2345 Longyang Road, Pudong New Area Shanghai P.R.C. 201204",Shanghai (China),China,http://www.hdeexpo.com/en/about/whats_hde,https://www.eventseye.com/fairs/f-hde-expobuild-china-19560-1.html
MOSBUILD 2023,"Moscow International Building and Construction, Decoration, Interior Design & Architecture Fair","March 28 - 31, 2023",Trade Public,once a year,Crocus-Expo IEC,Krasnogorsk 65-66 km Moscow Ring Road,Moscow (Russia),Russia,http://mosbuild.com/Home,https://www.eventseye.com/fairs/f-mosbuild-249-1.html
REBUILD 2023,"REBUILD provides a unique platform of innovation to invigorate the sector of construction, renovation and the energy efficiency of houses and buildings","March 28 - 30, 2023",Trade Public,once a year,Ifema - Parque Ferial Juan Carlos I,Feria de Madrid 28042 Madrid,Madrid (Spain),Spain,http://www.rebuildexpo.com/en,https://www.eventseye.com/fairs/f-rebuild-27713-1.html
MEDITERRANEAN PORTS & SHIPPING 2023,"Ports, Shipping and Logistics Exhibition and Conference","March 28 - 30, 2023",Trade Public,once a year,?,,Athens (Greece),Greece,http://www.transportevents.com/ForthcomingEvents.aspx,https://www.eventseye.com/fairs/f-mediterranean-ports-shipping-17956-1.html
SMART BUILDINGS & TERRITORIES SUMMIT 2023,Business meeting dedicated to the development of buildings and territories. SBTSummit brings together all the players in the sectors who are co-constructing a more sustainable territory,"March 28 - 29, 2023",Trade Public,once a year,Reims Champagne Congrès,"12, Boulevard du Général Leclerc 51100 Reims",Reims (France),France,http://sbtsummit.com,https://www.eventseye.com/fairs/f-smart-buildings-territories-summit-29526-1.html
CONSTRUMA 2023,International Construction Industry Trade Fair,"March 29 - April 02, 2023",Trade Public,once a year,Budapest Fair Centre,"1101 Budapest Albertirsai út 10. (Expo tér 1.)  1441 Budapest, Pf. 44.",Budapest (Hungary),Hungary,http://construma.hu/en,https://www.eventseye.com/fairs/f-construma-3932-1.html
ARCHITECTURE BUILDING WEEK 2023,"International business exhibition for energy efficient, ecological and functional construction","March 29 - April 01, 2023",Trade & General Public,once a year,Inter Expo Center,"147 Tsarigradsko Shaussee 1784, Sofia",Sofia (Bulgaria),Bulgaria,http://buildingweek.bg,https://www.eventseye.com/fairs/f-architecture-building-week-26587-1.html
